{
  "$schema": "https://json-schema.org/draft/2020-12/schema",
  "$id": "https://aktsmm.github.io/azure-ops-pulse-demo/schemas/public/v1.4/snapshot.schema.json",
  "title": "Azure Ops Pulse public snapshot v1.4",
  "type": "object",
  "required": [
    "schemaVersion",
    "generatedAt",
    "mode",
    "freshness",
    "scope",
    "sources",
    "overview",
    "cost",
    "inventory",
    "reliability",
    "security",
    "network",
    "aiInsights"
  ],
  "properties": {
    "schemaVersion": { "const": "1.4.0" },
    "generatedAt": { "type": "string", "format": "date-time" },
    "mode": { "enum": ["DEMO", "AZURE"] },
    "freshness": {
      "type": "object",
      "required": ["state", "ageMinutes", "lastSuccessfulCollection", "nextScheduledCollection"],
      "properties": {
        "state": { "enum": ["fresh", "stale"] },
        "ageMinutes": { "type": "number", "minimum": 0 },
        "lastSuccessfulCollection": { "type": "string", "format": "date-time" },
        "nextScheduledCollection": { "type": "string", "minLength": 5 }
      },
      "additionalProperties": false
    },
    "scope": {
      "type": "object",
      "required": ["displayName", "subscriptionId", "tenantId"],
      "properties": {
        "displayName": { "type": "string", "minLength": 1 },
        "subscriptionId": { "type": "string", "minLength": 4 },
        "tenantId": { "type": "string", "minLength": 4 }
      },
      "additionalProperties": false
    },
    "sources": {
      "type": "array",
      "items": {
        "type": "object",
        "required": ["source", "availability", "message"],
        "properties": {
          "source": { "type": "string" },
          "availability": { "enum": ["available", "partial", "unavailable"] },
          "message": { "type": "string" },
          "reason": { "$ref": "./source-reason.schema.json" }
        },
        "additionalProperties": false
      }
    },
    "overview": { "$ref": "./overview.schema.json" },
    "cost": { "$ref": "./cost.schema.json" },
    "inventory": { "$ref": "./inventory.schema.json" },
    "reliability": { "$ref": "./health-activity.schema.json" },
    "security": { "$ref": "./defender.schema.json" },
    "network": { "$ref": "./network.schema.json" },
    "advisor": { "$ref": "./advisor.schema.json" },
    "aiInsights": { "$ref": "./ai-insights.schema.json" }
  },
  "allOf": [
    {
      "$comment": "A source that reports partial has published real data, so aggregates stay allowed; only unavailable or a missing source must blank them out.",
      "if": {
        "not": {
          "type": "object",
          "properties": {
            "sources": {
              "type": "array",
              "contains": {
                "type": "object",
                "required": ["source", "availability"],
                "properties": {
                  "source": { "const": "Resource Health" },
                  "availability": { "enum": ["available", "partial"] }
                }
              }
            }
          }
        }
      },
      "then": {
        "type": "object",
        "properties": {
          "overview": {
            "type": "object",
            "properties": { "postureScore": { "type": "null" } }
          },
          "reliability": {
            "type": "object",
            "properties": {
              "incidentAvailability": { "const": "unavailable" },
              "incidents": { "type": "null" }
            }
          }
        }
      }
    },
    {
      "$comment": "Resource Health cannot claim it collected everything while no resource carries a state.",
      "if": {
        "type": "object",
        "properties": {
          "sources": {
            "type": "array",
            "contains": {
              "type": "object",
              "required": ["source", "availability"],
              "properties": {
                "source": { "const": "Resource Health" },
                "availability": { "const": "available" }
              }
            }
          }
        },
        "required": ["sources"]
      },
      "then": {
        "type": "object",
        "properties": {
          "reliability": {
            "type": "object",
            "properties": {
              "coverage": {
                "type": "object",
                "properties": { "evaluatedResources": { "type": "integer", "minimum": 1 } }
              }
            }
          }
        }
      }
    },
    {
      "$comment": "Conversely, an unavailable Resource Health source cannot coexist with evaluated resources.",
      "if": {
        "type": "object",
        "properties": {
          "sources": {
            "type": "array",
            "contains": {
              "type": "object",
              "required": ["source", "availability"],
              "properties": {
                "source": { "const": "Resource Health" },
                "availability": { "const": "unavailable" }
              }
            }
          }
        },
        "required": ["sources"]
      },
      "then": {
        "type": "object",
        "properties": {
          "reliability": {
            "type": "object",
            "properties": {
              "coverage": {
                "type": "object",
                "properties": { "evaluatedResources": { "const": 0 } }
              }
            }
          }
        }
      }
    },
    {
      "if": {
        "not": {
          "type": "object",
          "properties": {
            "sources": {
              "type": "array",
              "contains": {
                "type": "object",
                "required": ["source", "availability"],
                "properties": {
                  "source": { "const": "Defender for Cloud" },
                  "availability": { "enum": ["available", "partial"] }
                }
              }
            }
          }
        }
      },
      "then": {
        "type": "object",
        "properties": {
          "security": {
            "type": "object",
            "properties": {
              "secureScore": { "type": "null" },
              "activeAlerts": { "type": "null" },
              "recommendations": { "type": "array", "maxItems": 0 },
              "compliance": { "type": "array", "maxItems": 0 }
            }
          }
        }
      }
    }
  ],
  "additionalProperties": false
}
