{
  "schemaVersion": "1.4.0",
  "generatedAt": "2026-10-30T00:34:29.137Z",
  "mode": "AZURE",
  "freshness": {
    "state": "fresh",
    "ageMinutes": 0,
    "lastSuccessfulCollection": "2026-10-30T00:34:29.137Z",
    "nextScheduledCollection": "Tuesday / Friday 06:00 JST"
  },
  "scope": {
    "displayName": "Azure subscription",
    "subscriptionId": "subscription-anonymous",
    "tenantId": "tenant-anonymous"
  },
  "sources": [
    {
      "source": "Azure Resource Graph",
      "availability": "available",
      "message": "Read-only inventory collection completed."
    },
    {
      "source": "Cost Management",
      "availability": "available",
      "message": "Current and prior comparable rounded JPY periods were collected from 11 and 11 records."
    },
    {
      "source": "Resource Health",
      "availability": "partial",
      "message": "Resource Health evaluated 13 of 19 supported resources; 63 resources are outside Resource Health coverage."
    },
    {
      "source": "Service Health",
      "availability": "available",
      "message": "Service Health returned 5 events in aggregate."
    },
    {
      "source": "Activity Log",
      "availability": "available",
      "message": "7 recent Activity Log events were collected without actor or resource detail."
    },
    {
      "source": "Defender for Cloud",
      "availability": "partial",
      "message": "評価の読み取り成功: 0 件。 セキュア スコアは返されませんでした。 アクティブなアラートの読み取り成功: 0 件。 空の結果から Defender プランの有効・無効は判定していません。",
      "reason": "empty"
    },
    {
      "source": "Azure Advisor",
      "availability": "available",
      "message": "カテゴリ・影響度の件数は全ライフサイクルの推奨レコード数です。対応候補の内容別集計は完了・却下・延期を除外します。"
    },
    {
      "source": "Network topology",
      "availability": "partial",
      "message": "構成参照を一部収集しました。参照先が未収集・対象スコープ外、または一部プロパティが未取得です。線は通信状態を示しません。",
      "reason": "partial-collection"
    },
    {
      "source": "Network inventory and metrics",
      "availability": "partial",
      "message": "Network inventory covers 10 resources; 10 were sampled for Azure Monitor metrics; 3 exposed 4 metric series; 7 have no platform metrics; 0 could not be read. Flow telemetry was not collected."
    }
  ],
  "overview": {
    "metrics": [
      {
        "label": "Resource Health の評価範囲",
        "value": "68%",
        "change": "対応 19 件中 13 件を評価済み（対象外 63 件）",
        "direction": "flat",
        "severity": "info",
        "points": [
          68,
          68
        ]
      },
      {
        "label": "コストの収集範囲",
        "value": "収集済み",
        "change": "公開用に丸めた値",
        "direction": "flat",
        "severity": "healthy",
        "points": [
          1,
          1
        ]
      },
      {
        "label": "Defender recommendations",
        "value": "0",
        "change": "集計タイトルのみ",
        "direction": "flat",
        "severity": "info",
        "points": [
          0,
          0
        ]
      },
      {
        "label": "利用不可のソース",
        "value": "0",
        "change": "未収集を明示",
        "direction": "flat",
        "severity": "healthy",
        "points": [
          0,
          0
        ]
      }
    ],
    "postureScore": 100,
    "eventTimeline": [
      {
        "id": "event-55b8dadb",
        "timestamp": "現在のスナップショット",
        "severity": "healthy",
        "title": "Azure データ収集が完了",
        "detail": "82 件のリソースをサニタイズし、利用不可の任意ソースは 0 件でした。",
        "route": "/overview"
      },
      {
        "id": "event-cd198459",
        "timestamp": "2026-10-28T19:23:56.0649219Z",
        "severity": "info",
        "title": "管理操作を検出",
        "detail": "公開前に実行者と対象リソースの詳細を削除しています。",
        "route": "/overview"
      },
      {
        "id": "event-cc1982c6",
        "timestamp": "2026-10-28T19:23:55.2837061Z",
        "severity": "info",
        "title": "管理操作を検出",
        "detail": "公開前に実行者と対象リソースの詳細を削除しています。",
        "route": "/overview"
      },
      {
        "id": "event-cb198133",
        "timestamp": "2026-10-27T21:22:10.0696102Z",
        "severity": "info",
        "title": "推奨事項操作を検出",
        "detail": "公開前に実行者と対象リソースの詳細を削除しています。",
        "route": "/overview"
      },
      {
        "id": "event-ca197fa0",
        "timestamp": "2026-10-26T19:23:54.2187107Z",
        "severity": "info",
        "title": "管理操作を検出",
        "detail": "公開前に実行者と対象リソースの詳細を削除しています。",
        "route": "/overview"
      },
      {
        "id": "event-ff907070",
        "timestamp": "現在の収集期間",
        "severity": "warning",
        "title": "Service Health イベントを検出",
        "detail": "影響を受けたサブスクリプションやリソースの詳細を除き、サービス単位の状態のみを表示します。",
        "route": "/reliability"
      },
      {
        "id": "event-00907203",
        "timestamp": "現在の収集期間",
        "severity": "warning",
        "title": "Service Health イベントを検出",
        "detail": "影響を受けたサブスクリプションやリソースの詳細を除き、サービス単位の状態のみを表示します。",
        "route": "/reliability"
      }
    ],
    "regionalHealth": [
      {
        "region": "japaneast",
        "score": 100,
        "status": "healthy"
      },
      {
        "region": "southeastasia",
        "score": 100,
        "status": "healthy"
      },
      {
        "region": "eastasia",
        "score": 100,
        "status": "healthy"
      }
    ]
  },
  "cost": {
    "periodDiagnostics": {
      "current": {
        "availability": "available"
      },
      "previous": {
        "availability": "available"
      }
    },
    "current": {
      "availability": "available",
      "approximateAmount": "約¥2.2万"
    },
    "previous": {
      "availability": "available",
      "approximateAmount": "約¥2.4万"
    },
    "deltaPercent": -10.2,
    "forecast": {
      "availability": "unavailable",
      "approximateAmount": null
    },
    "budget": {
      "availability": "unavailable",
      "usedPercent": null
    },
    "normalizedTrend": [],
    "categories": [
      {
        "name": "Azure Cognitive Search",
        "approximateAmount": "約¥1.4万",
        "sharePercent": 64.8,
        "deltaPercent": -4.7
      },
      {
        "name": "Load Balancer",
        "approximateAmount": "約¥3千",
        "sharePercent": 12.2,
        "deltaPercent": -4.6
      },
      {
        "name": "Foundry Tools",
        "approximateAmount": "約¥2千",
        "sharePercent": 8.7,
        "deltaPercent": -41.2
      },
      {
        "name": "Storage",
        "approximateAmount": "約¥1千",
        "sharePercent": 4.7,
        "deltaPercent": -7.5
      },
      {
        "name": "Container Registry",
        "approximateAmount": "約¥1千未満",
        "sharePercent": 3.3,
        "deltaPercent": null
      },
      {
        "name": "Virtual Network",
        "approximateAmount": "約¥1千未満",
        "sharePercent": 2.4,
        "deltaPercent": null
      },
      {
        "name": "Logic Apps",
        "approximateAmount": "約¥1千未満",
        "sharePercent": 1.9,
        "deltaPercent": null
      },
      {
        "name": "Log Analytics",
        "approximateAmount": "約¥1千未満",
        "sharePercent": 1.8,
        "deltaPercent": null
      }
    ]
  },
  "inventory": {
    "total": 82,
    "resources": [
      {
        "id": "res-2b208491",
        "name": "smartdetectoralertrules-3d24b9da",
        "resourceGroup": "rg-d9a6959d",
        "type": "microsoft.alertsmanagement/smartdetectoralertrules",
        "region": "global",
        "status": "NotApplicable",
        "owner": "identity-caac8562",
        "tags": {},
        "change": "Azure Resource Graph から収集"
      },
      {
        "id": "res-4966dd95",
        "name": "containerapps-8d2a795c",
        "resourceGroup": "rg-d9a6959d",
        "type": "microsoft.app/containerapps",
        "region": "japaneast",
        "status": "NotApplicable",
        "owner": "identity-caac8562",
        "tags": {},
        "change": "Azure Resource Graph から収集"
      },
      {
        "id": "res-22393704",
        "name": "containerapps-3ea0c4c3",
        "resourceGroup": "rg-8c2924db",
        "type": "microsoft.app/containerapps",
        "region": "japaneast",
        "status": "NotApplicable",
        "owner": "identity-caac8562",
        "tags": {},
        "change": "Azure Resource Graph から収集"
      },
      {
        "id": "res-d1fe355c",
        "name": "jobs-c4355b20",
        "resourceGroup": "rg-d9a6959d",
        "type": "microsoft.app/jobs",
        "region": "japaneast",
        "status": "NotApplicable",
        "owner": "identity-caac8562",
        "tags": {},
        "change": "Azure Resource Graph から収集"
      },
      {
        "id": "res-f8cb8c1e",
        "name": "managedenvironments-881de1ed",
        "resourceGroup": "rg-d9a6959d",
        "type": "microsoft.app/managedenvironments",
        "region": "japaneast",
        "status": "NotApplicable",
        "owner": "identity-caac8562",
        "tags": {},
        "change": "Azure Resource Graph から収集"
      },
      {
        "id": "res-945836fd",
        "name": "managedenvironments-18ef8b6c",
        "resourceGroup": "rg-8c2924db",
        "type": "microsoft.app/managedenvironments",
        "region": "japaneast",
        "status": "NotApplicable",
        "owner": "identity-caac8562",
        "tags": {},
        "change": "Azure Resource Graph から収集"
      },
      {
        "id": "res-048f3ba7",
        "name": "automationaccounts-80faaaf7",
        "resourceGroup": "rg-39bccb00",
        "type": "microsoft.automation/automationaccounts",
        "region": "japaneast",
        "status": "NotApplicable",
        "owner": "identity-caac8562",
        "tags": {},
        "change": "Azure Resource Graph から収集"
      },
      {
        "id": "res-04c9456d",
        "name": "runbooks-dec1ffe6",
        "resourceGroup": "rg-39bccb00",
        "type": "microsoft.automation/automationaccounts/runbooks",
        "region": "japaneast",
        "status": "NotApplicable",
        "owner": "identity-caac8562",
        "tags": {},
        "change": "Azure Resource Graph から収集"
      },
      {
        "id": "res-43c653b8",
        "name": "runbooks-edc4eb65",